{
  "schema": "dusk.node-state/v1",
  "id": "01a112fe-d1bc-73b3-8e1a-4374396345a6",
  "time": "2026-10-06T09:14:53.512408170Z",
  "scope": "installation",
  "device_id": "3f9c0e2a7b5d4c1e8a6f0b2d9e7c5a13",
  "installation_id": "a41e6c2f9b0d4e7a8c3f5b1d2e9a6c70",
  "lifecycle": "active",
  "reason": null,
  "actor": "operator@example.org"
}
